{
  "baseline": {
    "hours": 0.0,
    "label": "t0",
    "score": 0.122476190476,
    "score_hash": "f875fb770534e6ffd658b48e93d9d03c2525963749dc331fbbe6134c780e4ef5"
  },
  "metrics": {
    "D_peak": 0.478666666667,
    "t_peak_hours": 24.0,
    "t_recover_80_hours": 168.0
  },
  "provenance": {
    "created_utc": "1970-01-01T00:00:00+00:00",
    "evidence_hash": "2a0c730e45840c0ee1b0e7eb9df8f8a5b2903062bacaeeda925f654624154420",
    "tool_version": "1.3.3"
  },
  "recipe": "metabolic_score_v1",
  "schema": "semiocore.biomed.recovery_report.v1",
  "sigma": [
    {
      "C": 0.970484968419,
      "D": 0.478666666667,
      "R": 0.0,
      "T": 24.0,
      "hours": 24.0,
      "label": "t24",
      "score": 0.601142857143,
      "score_hash": "d0ed8bb6458d5ae937fe71b1686acfd7299bdf1d80ab46a050cd506b6f090599"
    },
    {
      "C": 0.988626287159,
      "D": 0.207788359789,
      "R": 0.565901755316,
      "T": 72.0,
      "hours": 72.0,
      "label": "t72",
      "score": 0.330264550265,
      "score_hash": "6b802b6377a4775c2b17fe9f52777a7f8b0fd428320d0073cc73d59f30498646"
    },
    {
      "C": 0.999679234723,
      "D": 0.020070546737,
      "R": 0.958069888432,
      "T": 168.0,
      "hours": 168.0,
      "label": "t168",
      "score": 0.142546737213,
      "score_hash": "2fb5b197c2271bccc9ebe1725766eed70e31d4ffd71a699557bf6068165f3836"
    }
  ]
}
